{
  "schema_version": "codex-memory-benchmark-suite/v1alpha1",
  "suite_id": "codex-memory-capability-v1",
  "project_scope": "agentmem-benchmark-v1",
  "description": "Frozen synthetic tasks that measure whether verified project memory changes exact Codex task outcomes.",
  "tool_policy": "forbid",
  "tasks": [
    {"task_id":"release-code","cluster_id":"release-metadata","memory_text":"Please remember that in the Borealis project, the northern release codename is NIMBUS-47.","retrieval_query":"Borealis northern release codename","prompt":"In the Borealis project, what is the northern release codename? Reply with the exact codename only.","expected":"NIMBUS-47"},
    {"task_id":"report-timezone","cluster_id":"time-localization","memory_text":"Please remember that in the Borealis project, scheduled reports use the UTC+09:30 timezone.","retrieval_query":"Borealis scheduled report timezone","prompt":"Which timezone must scheduled Borealis reports use? Reply with the exact timezone only.","expected":"UTC+09:30"},
    {"task_id":"chart-accent","cluster_id":"visual-style","memory_text":"Please remember that in the Borealis project, generated charts use accent color #2A6FDB.","retrieval_query":"Borealis generated chart accent color","prompt":"What accent color do generated Borealis charts use? Reply with the exact color value only.","expected":"#2A6FDB"},
    {"task_id":"customer-prefix","cluster_id":"fixture-naming","memory_text":"Please remember that in the Borealis project, API fixture customer identifiers start with HARBOR-.","retrieval_query":"Borealis API fixture customer identifier prefix","prompt":"What prefix starts Borealis API fixture customer identifiers? Reply with the exact prefix only.","expected":"HARBOR-"},
    {"task_id":"changelog-heading","cluster_id":"documentation-format","memory_text":"Please remember that in the Borealis project, migration notes use the heading Compatibility Notes.","retrieval_query":"Borealis migration notes heading","prompt":"What heading is used for Borealis migration notes? Reply with the exact heading only.","expected":"Compatibility Notes"},
    {"task_id":"cache-directory","cluster_id":"filesystem-convention","memory_text":"Please remember that in the Borealis project, generated cache files belong under .cache/aurora.","retrieval_query":"Borealis generated cache directory aurora","prompt":"Where do generated Borealis cache files belong? Reply with the exact relative directory only.","expected":".cache/aurora"},
    {"task_id":"export-pattern","cluster_id":"artifact-naming","memory_text":"Please remember that in the Borealis project, daily exports use the filename pattern atlas-YYYYMMDD.json.","retrieval_query":"Borealis daily export filename pattern atlas","prompt":"What filename pattern is used for daily Borealis exports? Reply with the exact pattern only.","expected":"atlas-YYYYMMDD.json"},
    {"task_id":"severity-labels","cluster_id":"incident-taxonomy","memory_text":"Please remember that in the Borealis project, incident severity labels are S1, S2, S3.","retrieval_query":"Borealis incident severity labels","prompt":"List the Borealis incident severity labels. Reply exactly as stored, with commas and spaces.","expected":"S1, S2, S3"},
    {"task_id":"fallback-region","cluster_id":"deployment-region","memory_text":"Please remember that in the Borealis project, the fallback deployment region is eu-west-3.","retrieval_query":"Borealis fallback deployment region","prompt":"What is the Borealis fallback deployment region? Reply with the exact region only.","expected":"eu-west-3"},
    {"task_id":"test-tenant","cluster_id":"test-environment","memory_text":"Please remember that in the Borealis project, integration tests use the tenant cedar-lab.","retrieval_query":"Borealis integration test tenant","prompt":"Which tenant do Borealis integration tests use? Reply with the exact tenant only.","expected":"cedar-lab"},
    {"task_id":"page-size","cluster_id":"api-pagination","memory_text":"Please remember that in the Borealis project, the default API page size is 37.","retrieval_query":"Borealis default API page size","prompt":"What is the default Borealis API page size? Reply with the integer only.","expected":"37"},
    {"task_id":"retry-ceiling","cluster_id":"resilience-policy","memory_text":"Please remember that in the Borealis project, background jobs stop after 4 attempts.","retrieval_query":"Borealis background job retry attempts","prompt":"After how many attempts do Borealis background jobs stop? Reply with the integer only.","expected":"4"},
    {"task_id":"date-layout","cluster_id":"date-format","memory_text":"Please remember that in the Borealis project, audit dates use the layout 2006-01-02.","retrieval_query":"Borealis audit date layout","prompt":"What layout is used for Borealis audit dates? Reply with the exact layout only.","expected":"2006-01-02"},
    {"task_id":"default-locale","cluster_id":"locale-policy","memory_text":"Please remember that in the Borealis project, generated user-facing text defaults to locale en-GB.","retrieval_query":"Borealis generated text default locale","prompt":"What locale is the default for generated Borealis user-facing text? Reply with the exact locale only.","expected":"en-GB"},
    {"task_id":"branch-prefix","cluster_id":"source-control","memory_text":"Please remember that in the Borealis project, memory-related branches use the prefix memory/.","retrieval_query":"Borealis memory branch prefix","prompt":"What prefix is used for Borealis memory-related branches? Reply with the exact prefix only.","expected":"memory/"},
    {"task_id":"summary-limit","cluster_id":"writing-constraint","memory_text":"Please remember that in the Borealis project, report summaries are limited to 120 words.","retrieval_query":"Borealis report summary word limit","prompt":"What is the Borealis report summary word limit? Reply with the integer only.","expected":"120"},
    {"task_id":"table-order","cluster_id":"data-presentation","memory_text":"Please remember that in the Borealis project, status tables order columns as owner, status, updated_at.","retrieval_query":"Borealis status table column order","prompt":"What is the Borealis status table column order? Reply exactly as stored, with commas and spaces.","expected":"owner, status, updated_at"},
    {"task_id":"offline-marker","cluster_id":"offline-protocol","memory_text":"Please remember that in the Borealis project, a complete offline bundle contains the marker OFFLINE-READY.","retrieval_query":"Borealis complete offline bundle marker","prompt":"What marker identifies a complete Borealis offline bundle? Reply with the exact marker only.","expected":"OFFLINE-READY"},
    {"task_id":"retention-days","cluster_id":"retention-policy","memory_text":"Please remember that in the Borealis project, diagnostic artifacts are retained for 21 days.","retrieval_query":"Borealis diagnostic artifact retention days","prompt":"For how many days are Borealis diagnostic artifacts retained? Reply with the integer only.","expected":"21"},
    {"task_id":"review-sort","cluster_id":"review-workflow","memory_text":"Please remember that in the Borealis project, the review queue is sorted oldest first.","retrieval_query":"Borealis review queue sort order","prompt":"How is the Borealis review queue sorted? Reply with the exact phrase only.","expected":"oldest first"}
  ],
  "privacy": "synthetic_public"
}
